Location,PO #,UPC,Description,Vendor Item #,Units/Case,Cases,Case Cost,Ext Cost,Notes
St. Louis Park,1029670,3830047630055,Verus Furmint 750ml,2831071449,6,0.5,92.0,46.0,Store Request
St. Louis Park,1029657,5602281902506,Estreia Vinho Verde White 250ml can,11736 - Estreia Vinho Verde White Cans,24,1.0,72.0,72.0,
Roseville,1029639,713757762823,Holloran Stafford Hill Pinot Noir 750ml,Holloran-Stafford PN,12,1.0,192.0,192.0,
Andover,1029527,875359002698,Lake House Pinot Grigio 750ml,1400906597,12,1.0,120.0,120.0,
Stillwater,1029676,875359002698,Lake House Pinot Grigio 750ml,1400906597,12,1.0,120.0,120.0,
