Location,PO #,UPC,Description,Vendor Item #,Units/Case,Cases,Case Cost,Ext Cost,Notes
Plymouth,1030146,089419000160,La Vieille Ferme Rose 3L Box,18023,6,1.0,112.0,112.0,
Roseville,1030178,3760094280135,Dom Menard Cuvee Marine,26435,12,1.0,84.0,84.0,
Woodbury,1030229,400000024370,Failla Willamette Valley Pinot Noir 750ml,26450,12,1.0,250.0,250.0,
Vadnais Heights,1030216,747846010021,Hakutsuru Superior Junmai Ginjo Sake 300ml,7661,12,1.0,90.0,90.0,
St. Louis Park,1030196,830432002567,Mister Sauvignon Blanc 750ml,24455,12,1.0,152.0,152.0,
Minnetonka,1030129,850432002758,Wildsong Sauvignon Blanc 750ml,24733,12,1.0,120.0,120.0,Store Request
Minnetonka,1030130,859551001291,Matchbook The Arsonist Chardonnay 750ml,27357,12,1.0,126.0,126.0,
